{
  "entityType": "Character",
  "identifier": [
    {
      "identifierScope": "labkoat",
      "identifierValue": "chr/HNvHjXqJY9wv1IwjG-Hf1"
    }
  ],
  "characterName": {
    "scriptName": "Sven"
  },
  "description": "Sven is an unassuming Satellite repair man. He spends his time alone in his ship traveling to remote planets on the outskirt of the galaxy maintaining a network of exploration satellites. He is more of a lover than a fighter.",
  "profile": {
    "physicalCharacteristics": {
      "species": "Human",
      "hairColor": "Brown",
      "hairLength": "Short",
      "eyeColor": "Green",
      "height": "1m90cm",
      "weight": "80kg"
    },
    "background": {
      "likes": "Kiera, Space, Nature",
      "dislikes": "War, Big space cities, Conflict",
      "habits": "Sven is a bit of a sloth, happy to be far from prying eyes as he does his work at his pace. He is also a bit of a coward and has avoided the space navy at all cost. He is kind and patient and caring for the people in his life like Kiera.",
      "traits": "Sven is a helpful unassuming character who likes to be alone. He connects with his handlers like Kiera but is happy to be engrossed in his work. He is generally scared of all things and not a hero."
    }
  },
  "Context": {
    "entityType": "Context",
    "identifier": [
      {
        "identifierScope": "labkoat",
        "identifierValue": "cxt/377RXIREHUj5MPzsl-Sba"
      }
    ],
    "appearsIn": {
      "NarrativeScene": [
        {
          "entityType": "NarrativeScene",
          "identifier": [
            {
              "identifierScope": "labkoat",
              "identifierValue": "wrd/wz_MHOLYI3VwYx_0AX47Y"
            }
          ],
          "sceneName": {
            "fullName": "EXT - Jungle",
            "altName": "JGL"
          },
          "sceneNumber": "1",
          "description": "Title sequence with Sven bursting out of the jungle to the title sequence.",
          "slugline": [
            {
              "title": "INT/EXT",
              "text": "EXT"
            },
            {
              "title": "time",
              "text": "DAY"
            }
          ]
        },
        {
          "entityType": "NarrativeScene",
          "identifier": [
            {
              "identifierScope": "labkoat",
              "identifierValue": "wrd/St_Hh-LxAQo4ICUAtbZ0v"
            }
          ],
          "sceneName": {
            "fullName": "EXT- Space",
            "altName": "SPC"
          },
          "sceneNumber": "2",
          "description": "Sven repairs satellite and is ambushed by Trilobot",
          "slugline": [
            {
              "title": "INT/EXT",
              "text": "EXT"
            },
            {
              "title": "time",
              "text": "NIGHT"
            }
          ]
        },
        {
          "entityType": "NarrativeScene",
          "identifier": [
            {
              "identifierScope": "labkoat",
              "identifierValue": "wrd/xJpXtpM0G2QQM92TITfTf"
            }
          ],
          "sceneName": {
            "fullName": "EXT -Space Moments Later",
            "altName": "SPC"
          },
          "sceneNumber": "3",
          "description": "Sven reaches spaceship and climbs in.",
          "slugline": [
            {
              "title": "INT/EXT",
              "text": "EXT"
            },
            {
              "title": "time",
              "text": "NIGHT"
            }
          ]
        },
        {
          "entityType": "NarrativeScene",
          "identifier": [
            {
              "identifierScope": "labkoat",
              "identifierValue": "wrd/3EF7fR-xOJ7IamLr2iYsg"
            }
          ],
          "sceneName": {
            "fullName": "EXT - Atmosphere - DAY",
            "altName": "ATMO"
          },
          "sceneNumber": "4",
          "description": "Sven crashes into atmosphere and water",
          "slugline": [
            {
              "title": "INT/EXT",
              "text": "EXT"
            },
            {
              "title": "time",
              "text": "DAY"
            }
          ]
        },
        {
          "entityType": "NarrativeScene",
          "identifier": [
            {
              "identifierScope": "labkoat",
              "identifierValue": "wrd/lmPkGo1nXjJgfeNnoxArq"
            }
          ],
          "sceneName": {
            "fullName": "EXT - Beach - DAY",
            "altName": "BECH"
          },
          "sceneNumber": "5",
          "description": "Sven swims to surface and walks into beach.",
          "slugline": [
            {
              "title": "INT/EXT",
              "text": "EXT"
            },
            {
              "title": "time",
              "text": "DAY"
            }
          ]
        },
        {
          "entityType": "NarrativeScene",
          "identifier": [
            {
              "identifierScope": "labkoat",
              "identifierValue": "wrd/zH9BzX8cjf-wY6N-HE6fg"
            }
          ],
          "sceneName": {
            "fullName": "EXT- Jungle - Day",
            "altName": "JGL"
          },
          "sceneNumber": "6",
          "description": "Sven retreats to the jungle and destroys the Trilobot using exploding fruit native to the planet.",
          "slugline": [
            {
              "title": "INT/EXT",
              "text": "EXT"
            },
            {
              "title": "time",
              "text": "DAY"
            }
          ]
        },
        {
          "entityType": "NarrativeScene",
          "identifier": [
            {
              "identifierScope": "labkoat",
              "identifierValue": "wrd/1icPnKZ4LRliFd3WI9urA"
            }
          ],
          "sceneName": {
            "fullName": "EXT - Plateau - Day",
            "altName": "PLAT"
          },
          "sceneNumber": "7",
          "description": "Sven discovers city",
          "slugline": [
            {
              "title": "INT/EXT",
              "text": "EXT"
            },
            {
              "title": "time",
              "text": "DAY"
            }
          ]
        }
      ]
    },
    "usesProp": null,
    "usesWardrobe": {
      "NarrativeWardrobe": [
        {
          "entityType": "NarrativeWardrobe",
          "identifier": [
            {
              "identifierScope": "labkoat",
              "identifierValue": "wrd/Ia7-FdhY1yBFyqG_2nYW8"
            }
          ],
          "name": "Spacesuit",
          "description": "RD-12 Envrionmental Protection Suit"
        }
      ]
    }
  }
}